{
  "protocol": "dci.assembly/v1",
  "application_id": "dci.complete-application",
  "version": "1.0.0",
  "runtime_id": "pi.reference",
  "packages": [
    {"package_id": "dci.analysis", "version": "1.0.0"},
    {"package_id": "dci.benchmark", "version": "1.0.0"},
    {"package_id": "dci.evaluation", "version": "1.0.0"},
    {"package_id": "dci.export", "version": "1.0.0"},
    {"package_id": "dci.research", "version": "1.0.0"},
    {"package_id": "policy.local-corpus", "version": "1.0.0"}
  ],
  "host_capabilities": [],
  "host_policies": [],
  "host_events": ["artifact.created", "run.completed", "run.started", "tool.result"],
  "host_artifacts": ["text/plain"]
}
